{
  "$schema": "https://json-schema.org/draft/2020-12/schema",
  "$id": "https://sandra.local/schemas/relationship.schema.json",
  "title": "Relationship",
  "type": "object",
  "additionalProperties": false,
  "required": [
    "apiVersion",
    "kind",
    "metadata",
    "sourceRef",
    "type",
    "targetRef",
    "evidenceRefs",
    "validFrom",
    "validUntil"
  ],
  "properties": {
    "apiVersion": {
      "const": "governance.sandra.io/v1"
    },
    "kind": {
      "const": "Relationship"
    },
    "metadata": {
      "type": "object",
      "required": [
        "id"
      ],
      "properties": {
        "id": {
          "type": "string",
          "pattern": "^rel_[a-z0-9]{16,64}$"
        }
      },
      "additionalProperties": false
    },
    "sourceRef": {
      "type": "string",
      "pattern": "^obj_[a-z0-9]{16,64}$"
    },
    "type": {
      "enum": [
        "hostedOn",
        "dependsOn",
        "managedBy",
        "protectedBy",
        "backedUpBy",
        "resolvesThrough",
        "peerOf",
        "provides",
        "consumes"
      ]
    },
    "targetRef": {
      "type": "string",
      "pattern": "^obj_[a-z0-9]{16,64}$"
    },
    "evidenceRefs": {
      "type": "array",
      "items": {
        "type": "string",
        "pattern": "^evd_[a-z0-9]{16,64}$"
      },
      "minItems": 1,
      "uniqueItems": true
    },
    "validFrom": {
      "type": "string",
      "format": "date-time"
    },
    "validUntil": {
      "type": [
        "string",
        "null"
      ],
      "format": "date-time"
    }
  }
}
